date,title,description,source,url,category,source_type,insights
5/15/2025,Cognichip emerges from stealth with the goal of using generative AI to develop new chips,Chips are a critical component of the AI industry. But new chips don&#8217;t hit the market with the same speed as new AI models and products do. Cognichip has a lofty goal of creating a foundational AI model that can help bring new chips to market faster. San Francisco-based Cognichip is working to build a [&#8230;],techcrunch.com,https://techcrunch.com/2025/05/15/cognichip-emerges-from-stealth-with-the-goal-of-using-generative-ai-to-develop-new-chips/,ai ,News Source,
5/15/2025,Google rolls out new AI and accessibility features to Android and Chrome,"Google announced on Thursday that it&#8217;s rolling out new AI and accessibility features to Android and Chrome. Most notably, TalkBack, Android’s screen reader, now lets you ask Gemini about what&#8217;s in images and what&#8217;s on your screen. Last year, Google brought Gemini&#8217;s capabilities to TalkBack to give people who are blind or have low vision [&#8230;]",techcrunch.com,https://techcrunch.com/2025/05/15/google-rolls-out-new-ai-and-accessibility-features-to-android-and-chrome/,ai ,News Source,
5/15/2025,"Arm is rebranding its system-on-a-chip product designs to showcase power savings for AI workloads, targeting a surprising sector","For engineers orchestrating AI pipelines across environments, the modularity and performance tiering within Arm’s new architecture...",venturebeat.com,https://venturebeat.com/ai/arm-is-rebranding-its-system-on-a-chip-product-designs-to-showcase-power-savings-for-ai-workloads-targeting-a-surprising-sector/,ai ,News Source,
5/15/2025,"New AI and accessibility updates across Android, Chrome and more","An header with several accessibility icons and two Android devices, one showing TalkBack's new ask questions feature and the other showing expressive captions.",blog.google,https://blog.google/outreach-initiatives/accessibility/android-gemini-ai-gaad-2025/,ai ,News Source,
5/12/2025,Helping startups build what’s next with the AI Futures Fund,Text: AI Futures Fund from Google,blog.google,https://blog.google/technology/google-labs/ai-futures-fund/,ai ,News Source,
5/9/2025,What you missed at our record-breaking GenAI Intensive course,"Illustration of diverse individuals surrounded by scientific symbols, representing a community of learners.",blog.google,https://blog.google/technology/developers/google-kaggle-genai-intensive-recap-2025/,ai ,News Source,
5/8/2025,How we're using AI to drive scientific research with greater real-world benefit,Collage on a black background showing scientific images including a gloved hand on a microscope and a quantum computer,blog.google,https://blog.google/technology/research/google-research-scientific-discovery/,ai ,News Source,
5/7/2025,Google Research and ISTA are using light microscopes to “map” the brain.,"For more than a decade, Google Research has been using AI to precisely map the connections between every cell in the brain in an endeavor called connectomics. Now, in co…",blog.google,https://blog.google/technology/research/liconn-connectomics/,ai ,News Source,
2025-05-15,"The Download: Montana’s experimental treatments, and Google DeepMind’s new AI agent","This is today&#8217;s edition of The Download, our weekday newsletter that provides a daily dose of what&#8217;s going on in the world of technology. The first US hub for experimental medical treatments is coming The news: A bill that allows clinics to sell unproven treatments has been passed in Montana. Under the legislation, doctors can apply for&#8230;",technologyreview.com,https://www.technologyreview.com/2025/05/15/1116516/the-download-montanas-experimental-treatments-and-google-deepminds-new-ai-agent/,ai ,News Source,
2025-05-14,Google DeepMind’s new AI agent cracks real-world problems better than humans can,"Google DeepMind has once again used large language models to discover new solutions to long-standing problems in math and computer science. This time the firm has shown that its approach can not only tackle unsolved theoretical puzzles, but improve a range of important real-world processes as well. Google DeepMind&#8217;s new tool, called AlphaEvolve, uses the&#8230;",technologyreview.com,https://www.technologyreview.com/2025/05/14/1116438/google-deepminds-new-ai-uses-large-language-models-to-crack-real-world-problems/,ai ,News Source,
2025-05-13,"The Download: CRISPR in court, and the police’s ban-skirting AI","This is today&#8217;s edition of The Download, our weekday newsletter that provides a daily dose of what&#8217;s going on in the world of technology. A US court just put ownership of CRISPR back in play The CRISPR patents are back in play. Yesterday, the US Court of Appeals for the Federal Circuit said scientists Jennifer Doudna and&#8230;",technologyreview.com,https://www.technologyreview.com/2025/05/13/1116357/the-download-crispr-in-court-and-the-polices-ban-skirting-ai/,ai ,News Source,
2025-05-13,Police tech can sidestep facial recognition bans now,"Six months ago I attended the largest gathering of chiefs of police in the US to see how they’re using AI. I found some big developments, like officers getting AI to write their police reports. Today, I published a new story that shows just how far AI for police has developed since then.&#160; It’s about&#8230;",technologyreview.com,https://www.technologyreview.com/2025/05/13/1116321/police-tech-can-sidestep-facial-recognition-bans-now/,ai ,News Source,
2025-05-15,OpenAI’s flagship GPT-4.1 model is now in ChatGPT,"The latest versions of OpenAI’s multimodal GPT AI models are now rolling out to ChatGPT. OpenAI announced on Wednesday that GPT-4.1 will be available across all paid ChatGPT account tiers and can now be accessed by Plus, Pro, or Team users under the model picker dropdown menu. Free users are excluded from the rollout, but [&#8230;]",theverge.com,https://www.theverge.com/news/667507/openai-chatgpt-gpt-4-1-ai-model-general-availability,ai ,News Source,
2025-05-14,SoundCloud changes its TOS again after an AI uproar,"Music-sharing platform SoundCloud is saying it “has never used artist content to train AI models,” and that it’s “making a formal commitment that any use of AI on SoundCloud will be based on consent, transparency, and artist control.” The update comes several days after artists reported that changes made last year to its terms of [&#8230;]",theverge.com,https://www.theverge.com/news/667420/soundcloud-ai-training-copyright-tos,ai ,News Source,
2025-05-14,Grok really wanted people to know that claims of white genocide in South Africa are highly contentious,"Grok, the AI model from Elon Musk’s xAI, was sending strange responses to people on X earlier on Wednesday. In responses to a number of people, Grok focused on debunking claims of white genocide in South Africa – even when tagged into a post about totally unrelated topics. Check out this thread to get an [&#8230;]",theverge.com,https://www.theverge.com/news/667179/x-twitter-grok-ai-white-genocide-claims,ai ,News Source,
2025-05-14,Nvidia&#8217;s flattery of Trump wins reversal of AI chip limits and a Huawei clampdown,"Nvidia’s efforts to suck up to the Trump administration have seemingly paid off, with the US now lifting export limits on US-made AI chips and cracking down on anyone using Huawei’s emerging alternatives. The announcements come as Nvidia CEO Jensen Huang joined President Trump in Saudi Arabia this week to solicit AI investments for US [&#8230;]",theverge.com,https://www.theverge.com/news/666605/nvidias-flattery-of-trump-wins-reversal-of-ai-chip-limits-and-a-huawei-clampdown,ai ,News Source,
2025-05-13,Judge slams lawyers for &#8216;bogus AI-generated research&#8217;,"A California judge slammed a pair of law firms for the undisclosed use of AI after he received a supplemental brief with “numerous false, inaccurate, and misleading legal citations and quotations.” In a ruling submitted last week, Judge Michael Wilner imposed $31,000 in sanctions against the law firms involved, saying “no reasonably competent attorney should [&#8230;]",theverge.com,https://www.theverge.com/news/666443/judge-slams-lawyers-ai-bogus-research,ai ,News Source,
2025-05-15,Google rolls out new AI and accessibility features to Android and Chrome,"Google announced on Thursday that it&#8217;s rolling out new AI and accessibility features to Android and Chrome. Most notably, TalkBack, Android’s screen reader, now lets you ask Gemini about what&#8217;s in images and what&#8217;s on your screen. Last year, Google brought Gemini&#8217;s capabilities to TalkBack to give people who are blind or have low vision [&#8230;]",techcrunch.com,https://techcrunch.com/2025/05/15/google-rolls-out-new-ai-and-accessibility-features-to-android-and-chrome/,ai ,News Source,
2025-05-15,Cognichip emerges from stealth with the goal of using generative AI to develop new chips,Chips are a critical component of the AI industry. But new chips don&#8217;t hit the market with the same speed as new AI models and products. Cognichip has a lofty goal of creating a foundational AI model that can help bring new chips to market faster. San Francisco-based Cognichip is working to build a physics-informed [&#8230;],techcrunch.com,https://techcrunch.com/2025/05/15/cognichip-emerges-from-stealth-with-the-goal-of-using-generative-ai-to-develop-new-chips/,ai ,News Source,
2025-05-15,Harvey reportedly in discussions to raise $250M at $5B valuation,"Harvey AI is in discussions to raise more than $250 million in a funding round led by Kleiner Perkins and Coatue that would value it at $5 billion, Reuters reported",techcrunch.com,https://techcrunch.com/2025/05/15/harvey-reportedly-in-discussions-to-raise-250m-at-5b-valuation/,ai ,News Source,
2025-05-14,Grok is unpromptedly telling X users about South African ‘white genocide’,"Elon Musk&#8217;s AI chatbot Grok appeared to experience a bug on Wednesday that caused it to reply to dozens of posts on X with information about &#8220;white genocide&#8221; in South Africa, even when the user didn&#8217;t ask anything about the subject. The strange responses stem from the X account for Grok, which replies to users [&#8230;]",techcrunch.com,https://techcrunch.com/2025/05/14/grok-is-unpromptedly-telling-x-users-about-south-african-genocide/,ai ,News Source,
2025-05-14,OpenAI brings its GPT-4.1 models to ChatGPT,"OpenAI is releasing its GPT-4.1 and GPT-4.1 mini AI models in ChatGPT, the company announced in a post on X Wednesday. The GPT-4.1 models should help software engineers who are using ChatGPT to write or debug code, OpenAI spokesperson Shaokyi Amdo told TechCrunch. GPT-4.1 excels at coding and instruction following compared to GPT-4o, according to [&#8230;]",techcrunch.com,https://techcrunch.com/2025/05/14/openai-brings-its-gpt-4-1-models-to-chatgpt/,ai ,News Source,
2025-05-15,"With AI, researchers predict the location of virtually any protein within a human cell","Trained with a joint understanding of protein and cell behavior, the model could help with diagnosing disease and developing new drugs.",news.mit.edu,https://news.mit.edu/2025/researchers-predict-protein-location-within-human-cell-using-ai-0515," ai,",News Source,
2025-05-14,Study shows vision-language models can’t handle queries with negation words,"Words like “no” and “not” can cause this popular class of AI models to fail unexpectedly in high-stakes settings, such as medical diagnosis.",news.mit.edu,https://news.mit.edu/2025/study-shows-vision-language-models-cant-handle-negation-words-queries-0514,ai ,News Source,
2025-05-06,"Hybrid AI model crafts smooth, high-quality videos in seconds","The CausVid generative AI tool uses a diffusion model to teach an autoregressive (frame-by-frame) system to rapidly produce stable, high-resolution videos.",news.mit.edu,https://news.mit.edu/2025/causevid-hybrid-ai-model-crafts-smooth-high-quality-videos-in-seconds-0506,ai ,News Source,
2025-05-05,New tool evaluates progress in reinforcement learning,"“IntersectionZoo,” a benchmarking tool, uses a real-world traffic problem to test progress in deep reinforcement learning algorithms.",news.mit.edu,https://news.mit.edu/2025/new-tool-evaluate-progress-reinforcement-learning-0505,reinforcement learning,News Source,
2025-05-02,Novel AI model inspired by neural dynamics from the brain,New type of “state-space model” leverages principles of harmonic oscillators.,news.mit.edu,https://news.mit.edu/2025/novel-ai-model-inspired-neural-dynamics-from-brain-0502,ai ,News Source,
2025-05-15,"Arm is rebranding its system-on-a-chip product designs to showcase power savings for AI workloads, targeting a surprising sector","For engineers orchestrating AI pipelines across environments, the modularity and performance tiering within Arm’s new architecture...",venturebeat.com,https://venturebeat.com/ai/arm-is-rebranding-its-system-on-a-chip-product-designs-to-showcase-power-savings-for-ai-workloads-targeting-a-surprising-sector/,ai ,News Source,
2025-05-15,"You.com’s ARI Enterprise crushes OpenAI in head-to-head tests, aims at deep research market","You.com launches ARI Enterprise, an AI research platform that outperforms OpenAI in 76% of head-to-head tests and integrates with enterprise data sources to transform business intelligence with 400+ source analysis.",venturebeat.com,https://venturebeat.com/ai/you-coms-ari-enterprise-crushes-openai-in-head-to-head-tests-aims-at-deep-research-market/,ai ,News Source,
2025-05-14,OpenAI brings GPT-4.1 and 4.1 mini to ChatGPT — what enterprises should know,"As OpenAI continues to evolve its model offerings, GPT-4.1 represents a step forward in democratizing advanced AI for enterprise environments",venturebeat.com,https://venturebeat.com/ai/openai-brings-gpt-4-1-and-4-1-mini-to-chatgpt-what-enterprises-should-know/,ai ,News Source,
2025-05-14,Beyond sycophancy: DarkBench exposes six hidden ‘dark patterns’ lurking in today’s top LLMs,"Without a strong push from AI companies to combat sycophancy and other dark patterns, the default trajectory is more engagement optimization, more manipulation and fewer checks.",venturebeat.com,https://venturebeat.com/ai/darkness-rising-the-hidden-dangers-of-ai-sycophancy-and-dark-patterns/,ai ,News Source,
2025-05-14,"Elon Musk’s Grok AI is spamming X users about South African race relations now, for some reason","Grok was caught earlier this year censoring results critical of President Trump and Musk himself, sowing more doubt of its factual integrity.",venturebeat.com,https://venturebeat.com/ai/elon-musks-grok-ai-is-spamming-x-users-about-south-african-race-relations-now-for-some-reason/,ai ,News Source,
2025-05-15,"You can try Microsoft's free AI skills training for two more weeks, and I recommend you do","Microsoft's AI Skills Fest offers free AI training for beginners and pros, plus prizes and discounts. You can register now for free access through May 28th.",zdnet.com,https://www.zdnet.com/article/you-can-try-microsofts-free-ai-skills-training-for-two-more-weeks-and-i-recommend-you-do/,ai ,News Source,
2025-05-15,"Box's new AI agents can organize, find, and extract data from documents for you",They will be released in the coming months for enterprise customers.,zdnet.com,https://www.zdnet.com/article/boxs-new-ai-agents-can-organize-find-and-extract-data-from-documents-for-you/,ai ,News Source,
2025-05-15,"GPT-4.1 makes ChatGPT smarter, faster, and more useful for paying users, especially coders","OpenAI's GPT-4.1 upgrade is more than just hype. Here's how this model outperforms GPT-4o in software development, long-form tasks, and accuracy, according to developers already using it.",zdnet.com,https://www.zdnet.com/article/gpt-4-1-makes-chatgpt-smarter-faster-and-more-useful-for-paying-users-especially-coders/,gpt,News Source,
2025-05-14,Google offers AI certification for business leaders now - and the training is free,"If you want to learn how to successfully implement AI into your business, this free course could be for you.",zdnet.com,https://www.zdnet.com/article/google-offers-ai-certification-for-business-leaders-now-and-the-training-is-free/,ai ,News Source,
2025-05-14,You can make a photo come alive with TikTok's new AI tool - here's how,"I tried TikTok's new AI Alive feature in the Story Camera - and it's a fun, clever way to bring photos to life.",zdnet.com,https://www.zdnet.com/article/you-can-make-a-photo-come-alive-with-tiktoks-new-ai-tool-heres-how/,ai ,News Source,
2025-05-15,"The State Of Application Security, 2025: Yes, AI Just Made It Harder To Do This Right","Our annual report on the state of application security is one of our favorites. We love digging into the data to see how priorities and adoption have changed. This year, the explosion of AI in applications and in-application development exacerbated existing trends and introduced new concerns. Here are some areas that got our attention. AI [&#8230;]",forrester.com,https://www.forrester.com/blogs/application-security-2025-yes-ai-just-made-it-harder-to-do-this-right/,ai ,Forrester Research,"Our annual report on the state of application security is one of our favorites. We love digging into the data to see how priorities and adoption have changed. This year, the explosion of AI in applications and in-application development exacerbated existing trends and introduced new concerns."
2025-05-15,Master Tech Mayhem: Technology & Innovation Summit APAC,"For technology leaders in APAC, the pressing question is no longer about whether AI will transform your business but how you will leverage AI to lead your organization through global volatility and escalating costs. Learn how Technology &#038; Innovation Summit APAC will equip you with the skills, practices, and platforms you need to master today’s tech mayhem and and navigate a volatile environment.",forrester.com,https://www.forrester.com/blogs/master-tech-mayhem-technology-innovation-summit-apac/,ai ,Forrester Research,"For technology leaders in APAC, the pressing question is no longer about whether AI will transform your business but how you will leverage AI to lead your organization through global volatility and escalating costs."
2025-05-15,Anthropic’s lawyer was forced to apologize after Claude hallucinated a legal citation,"A lawyer representing Anthropic admitted to using an erroneous citation created by the company&#8217;s Claude AI chatbot in its ongoing legal battle with music publishers, according to a filing made in a Northern California court on Thursday. Claude hallucinated the citation with &#8220;an inaccurate title and inaccurate authors,&#8221; Anthropic says in the filing, first reported [&#8230;]",techcrunch.com,https://techcrunch.com/2025/05/15/anthropics-lawyer-was-forced-to-apologize-after-claude-hallucinated-a-legal-citation/,ai ,News Source,
2025-05-15,Programmers bore the brunt of Microsoft’s layoffs in its home state as AI writes up to 30% of its code,Microsoft's Washington layoffs hit coders hardest as the tech giant embraces AI.,techcrunch.com,https://techcrunch.com/2025/05/15/programmers-bore-the-brunt-of-microsofts-layoffs-in-its-home-state-as-ai-writes-up-to-30-of-its-code/,ai ,News Source,
